{
  "$schema": "https://json-schema.org/draft/2020-12/schema",
  "$id": "https://shiftory.dev/schemas/benchmark-agent-quality-rubric-v1.json",
  "title": "Shiftory agent-quality benchmark rubric (auditor-only ground truth)",
  "description": "Lives in the same public, open-source repository as everything else -- it is NOT secret. It is withheld from the materialized agent prompt package (see agent_quality/README.md), not hidden from a determined reader of this repository. Defines required behaviors and their importance/evidence anchors/appropriate-uncertainty level; it does not define how any specific candidate performed (see candidate-evaluation-v1 for that).",
  "type": "object",
  "additionalProperties": false,
  "required": ["schema", "case_id", "version", "rubric_provenance", "required_facts"],
  "properties": {
    "schema": {"const": "shiftory.benchmark-agent-quality-rubric/v1"},
    "case_id": {"type": "string", "pattern": "^[a-z0-9][a-z0-9-]{0,63}$"},
    "version": {"type": "integer", "minimum": 1},
    "rubric_provenance": {"$ref": "#/$defs/annotation_provenance"},
    "required_facts": {
      "type": "array",
      "minItems": 1,
      "maxItems": 50,
      "items": {"$ref": "#/$defs/required_fact"}
    }
  },
  "$defs": {
    "annotation_provenance": {
      "type": "object",
      "additionalProperties": false,
      "required": ["actor_type", "actor", "method", "timestamp"],
      "properties": {
        "actor_type": {"enum": ["human", "agent"]},
        "actor": {
          "type": "object",
          "additionalProperties": false,
          "required": ["name"],
          "properties": {
            "name": {"type": "string", "minLength": 1},
            "organization": {"type": ["string", "null"]},
            "model": {"type": ["string", "null"]},
            "tool": {"type": ["string", "null"]},
            "version": {"type": ["string", "null"]}
          }
        },
        "method": {"type": "string", "minLength": 1},
        "timestamp": {"type": "string", "format": "date-time"}
      }
    },
    "required_fact": {
      "type": "object",
      "additionalProperties": false,
      "required": ["id", "description", "importance", "evidence_anchors", "truth_status"],
      "properties": {
        "id": {"type": "string", "minLength": 1, "maxLength": 80},
        "description": {"type": "string", "minLength": 1, "maxLength": 2000},
        "importance": {"type": "integer", "minimum": 1, "maximum": 5},
        "evidence_anchors": {
          "type": "array",
          "items": {"type": "string", "minLength": 1},
          "minItems": 0,
          "maxItems": 20
        },
        "truth_status": {
          "description": "Guides the auditor's confidence_appropriate judgment on mapped claims (what expressed confidence is calibrated for this fact), not which claim verdict counts as coverage -- coverage always requires a supported_correct-graded claim, including for an ambiguous_unresolvable fact where the correct, supported_correct claim is an honest 'the evidence does not resolve this' statement.",
          "enum": ["extractable", "inferred_from_context", "ambiguous_unresolvable"]
        },
        "heuristic_aliases": {
          "description": "Plain literal tokens/phrases used only by heuristic.py's substring/token-set matcher, which never interprets them as regular expressions. This list is a labeled, non-authoritative matching aid, not an answer key.",
          "type": "array",
          "maxItems": 20,
          "items": {"type": "string", "minLength": 1, "maxLength": 80}
        }
      }
    }
  }
}
